filename,text,main_category,sub_category,target_label,summary
430.txt,"US prepares for hybrid onslaught

Sales of hybrid cars in the US are set to double in 2005, research suggests.

Research group JD Power estimates sales will hit 200,000 in 2005, despite higher prices and customer scepticism. Carmakers are starting to build hybrid sports utility vehicles (SUVs), the four-wheel-drive vehicles which now dominate the US car market. Hybrids cut both petrol consumption and emissions by combining a petrol engine with an electric motor constantly kept charged by extra engine power. Several jurisdictions, notably the state of California, mandate low emissions for new cars. Equally, the rise in oil prices over the past year has sparked hopes that consumers may be tempted by potential savings of a few hundred dollars a year on fuel.

At the Detroit Motor Show, a range of manufacturers are prominently displaying their hybrid credentials. Toyota has led the market to date with the Prius, popularised by a number of celebrities keen to burnish their ""green"" credentials. In April it will launch a hybrid version of its Highlander SUV, with an SUV from its luxury Lexus marque due later in the year.

Honda has three hybrids on the market, and between them the two Japanese carmakers sold more than 80,000 units last year. Ford, which has sold 4,000 of its first hybrid since its launch in August, is bringing a hybrid SUV - the Mariner - to market a year ahead of schedule, with plans for three more models by 2008. GM has a hybrid pickup on the market and is showing two concept SUVs in Detroit. Even sports car maker Porsche may join the race, although it insists it is still considering whether to hybridise its Cayenne SUV.

Others remain more sceptical. Nissan has bought Toyota's hybrid technology, but plans to bring out its first model only in 2006. ""We want to make sure we are not concentrating on one technology,"" Nissan chief executive Carlos Ghosn said. ""We will not be surprised by any acceleration or deceleration in the hybrid market."" Volkswagen, meanwhile, says it will focus on clean-burning diesel engines instead. And some watchers point out that the price tag on a hybrid - upwards of $3,000 above that of an equivalent normal-engined car, and suspicion of the technology - may still cool its attraction. ""The average consumers aren't willing to pay that premium for a car they won't drive more than six years,"" said Anthony Pratt from JD Power.
",business,Stock Market,Stock Market,"Research group estimates sales will hit 200,000 in 2005. Toyota has led the market to date with the Prius, popularised by a number of celebrities keen to burnish their ""green"" credentials."
065.txt,"Radcliffe will compete in London

Paula Radcliffe will compete in the Flora London Marathon this year after deciding her schedule for 2005.

The 31-year-old won the race in 2002 on her marathon debut, defended her title 12 months later and will now seek a third title in the 17 April race. ""It doesn't get any better than this for the 25th anniversary,"" said race director David Bedford. ""After announcing the greatest men's field ever we now have the greatest women's distance runner ever."" Three years ago Radcliffe smashed the women's world record in two hours 18 minutes 15 seconds.

The Bedford star returned to London 12 months later, lowering her mixed-race world record of 2:17:18, which she set in Chicago in October 2003, by one minute 53 secs. Radcliffe's career took a setback when she failed to complete the Olympic marathon and later dropped out of the Athens 10,000m last August. But the 31-year-old bounced back to win the New York Marathon in November. Radcliffe, however, passed up the chance to go for the ""Big City"" marathon grand slam. With wins in Chicago, London and New York, only the Boston Marathon remains to be conquered but that takes place a day after London. ""Boston is definitely a race I want to do at some point, but London is very special to me,"" said Radcliffe. ""I don't pick races thinking about things like pressure. I pick the ones in my heart I really want to do. ""I love the atmosphere, crowds and course and know it will always be a great quality race. ""It is also the 25th anniversary this year which adds to the occasion.""
",sport,Tennis,Tennis,"Radcliffe will compete in the Flora London Marathon this year after deciding her schedule for 2005. The 31-year-old won the race in 2002 on her marathon debut, defended her title 12 months later and will now seek a third title in the 17 April race."
007.txt,"O'Sullivan commits to Dublin race

Sonia O'Sullivan will seek to regain her title at the Bupa Great Ireland Run on 9 April in Dublin.

The 35-year-old was beaten into fourth at last year's event, having won it a year earlier. ""I understand she's had a solid winter's training down in Australia after recovering from a minor injury,"" said race director Matthew Turnbull. Mark Carroll, Irish record holder at 3km, 5km and 10km, will make his debut in the mass participation 10km race. Carroll has stepped up his form in recent weeks and in late January scored an impressive 3,000m victory over leading American Alan Webb in Boston. Carroll will be facing stiff competition from Australian Craig Mottram, winner in Dublin for the last two years.
",sport,General Sport,General Sport,"Sonia O'Sullivan will seek to regain her title at the Bupa Great Ireland Run. The 35-year-old was beaten into fourth at last year's event. Mark Carroll, Irish record holder at 3km, 5km and 10km will make his debut in the mass participation 10km race."
252.txt,"Virus poses as Christmas e-mail

Security firms are warning about a Windows virus disguising itself as an electronic Christmas card.

The Zafi.D virus translates the Christmas greeting on its subject line into the language of the person receiving infected e-mail. Anti-virus firms speculate that this multilingual ability is helping the malicious program spread widely online. Anti-virus firm Sophos said that 10% of the e-mail currently on the net was infected with the Zafi virus.

Like many other Windows viruses, Zafi-D plunders Microsoft Outlook for e-mail addresses and then uses mail-sending software to despatch itself across the web to new victims. To be infected users must open up the attachment travelling with the message which bears the code for the malicious bug. The attachment on the e-mail poses as an electronic Christmas card but anyone opening it will simply get a crude image of two smiley faces.

The virus' subject line says ""Merry Christmas"" and translates this into one of 15 languages depending of the final suffix of the e-mail address the infected message has been sent to. The message in the body of the e-mail reads: ""Happy Holidays"" and this too is translated. On infected machines the virus tries to disable anti-virus and firewall software and opens up a backdoor on the PC to hand over control to the writer of the virus. The virus is thought to have spread most widely in South America, Italy, Spain, Bulgaria and Hungary. The original Zafi virus appeared in April this year. ""We have seen these hoaxes for several Christmases already, and personally I prefer traditional pen and paper cards, and we recommend this to all our clients too,"" said Mikko Hypponen, who heads F-Secure's anti-virus team.
",tech,tech,tech,Virus poses as Christmas e-mail and translates greeting into 15 languages. Anti-virus firm Sophos says 10% of e-mails are infected with the Zafi virus.
104.txt,"Royal couple watch nation's mood

Prince Charles and Camilla Parker Bowles are awaiting the nation's reaction after announcing they are to be married on 8 April.

Mrs Parker Bowles will take the title HRH Duchess of Cornwall after a civil ceremony to be held at Windsor Castle. A Daily Telegraph poll of 1,313 people suggests two-thirds of Britons support the couple's decision to marry. But only 40% think Mrs Parker Bowles should become Princess Consort as planned after Charles becomes king. Some 47% believe she should have no title, while 7% think she should become queen.

The poll also found that the majority of Britons would prefer the monarchy to miss a generation, with the Queen handing the throne to her grandson Prince William, 22, on her death or abdication. On Thursday night, Prince Charles, 56, and Mrs Parker Bowles, 57, hosted a dinner at Windsor Castle, their first public appearance since announcing their engagement. Mrs Parker Bowles said the prince went down on one knee to propose and added: ""I'm just coming down to earth."" She displayed her diamond engagement ring - a Royal Family heirloom - to reporters. Charles said he and his wife-to-be were ""absolutely delighted"". Their marriage will end years of speculation on a relationship which dates back to 1970.

The Queen and Duke of Edinburgh said the news had made them ""very happy"". Princes William and Harry said they are ""very happy"" and wish the couple ""all the luck in the future"". The wedding will be a civil ceremony followed by a service of prayer and dedication in St George's Chapel at which the Archbishop of Canterbury, Dr Rowan Williams, will preside.

The marriage is likely to be a sensitive issue because Mrs Parker Bowles is divorced and her former husband is still alive. If he became king, Charles would be the supreme governor of the Church of England and some Anglicans remain opposed to the remarriage of divorcees. ""His divorce from Diana and the disappointment the country felt over how Diana had been treated... opened up a sense of disillusionment with [Prince Charles],"" said Ros Coward, who wrote the authorised biography of Diana, princess of Wales. The Archbishop of Canterbury said: ""I am pleased that Prince Charles and Mrs Camilla Parker Bowles have decided to take this important step."" Tony Blair said he was ""delighted"" for the couple and offered his congratulations, as did Conservative leader Michael Howard and Liberal Democrat leader Charles Kennedy. Australia's Prime Minister John Howard also offered his congratulations, adding that their decision to marry was a ""sensible and a good thing"". Mrs Parker Bowles has joined the prince at numerous engagements in recent years - mostly at evening events for The Prince's Trust. Clarence House staff were at pains to point out that she attended these events in a private capacity.
",politics,politics,politics,Two-thirds of Britons support the couple's decision to marry. But only 40% think Mrs Parker Bowles should become Princess Consort. Some 47% believe she should have no title.
490.txt,"Brazil jobless rate hits new low

Brazil's unemployment rate fell to its lowest level in three years in December, according to the government.

The Brazilian Institute for Geography and Statistics (IBGE) said it fell to 9.6% in December from 10.6% in November and 10.9% in December 2003. IBGE also said that average monthly salaries grew 1.9% in December 2004 from December 2003. However, average monthly wages fell 1.8% in December to 895.4 reais ($332; £179.3) from November. Tuesday's figures represent the first time that the unemployment rate has fallen to a single digit since new measurement rules were introduced in 2001. The unemployment rate has been falling gradually since April 2004 when it reached a peak of 13.1%. The jobless rate average for the whole of 2004 was 11.5%, down from 12.3% in 2003, the IBGE said.

This improvement can be attributed to the country's strong economic growth, with the economy registering growth of 5.2% in 2004, the government said. The economy is expected to grow by about 4% this year. President Luiz Inacio Lula da Silva promised to reduce unemployment when he was elected two years ago. Nevertheless, some analysts say that unemployment could increase in the next months. ""The data is favourable, but a lot of jobs are temporary for the (Christmas) holiday season, so we may see slightly higher joblessness in January and February,"" Julio Hegedus, chief economist with Lopes Filho & Associates consultancy in Rio de Janeir, told Reuters news agency. Despite his leftist background, President Lula has pursued a surprisingly conservative economic policy, arguing that in order to meet its social promises, the government needs to first reach a sustained economic growth. The unemployment rate is measured in the six main metropolitan areas of Brazil (Sao Paolo, Rio de Janeiro, Belo Horizonte, Recife, Salvador and Porto Alegre), where most of the population is concentrated.
",business,Economy,Economy,Brazil's unemployment rate fell to its lowest level in three years in December. The unemployment rate has been falling gradually since April 2004 when it reached a peak of 13.1%. Average monthly salaries grew 1.9% in December 2004 from December 2003.
aug_1_065.txt,Paula Radcliffe will compete in the Flora London Marathon this year . the 31-year-old won the race in 2002 on her marathon debut . she will now seek a third title in the 17 April race .,sport,Tennis,Tennis,Paula Radcliffe will compete in the Flora London Marathon this year. The 31-year-old won the race in 2002 on her marathon debut. She will seek a third title in the 17 April race.
aug_3_065.txt,Paula Radcliffe will compete in the Flora London Marathon this year after deciding her schedule for 2005 . the 31-year-old won the race in 2002 on her marathon debut and defended her title 12 months later . Radcliffe will now seek a third title in the 17 April race .,sport,Tennis,Tennis,Paula Radcliffe will compete in the Flora London Marathon this year. Radcliffe won the race in 2002 on her marathon debut and defended her title 12 months later. The 31-year-old will seek a third title in the 17 April race.
aug_4_065.txt,Paula Radcliffe will compete in the Flora London Marathon this year . the 31-year-old won the race in 2002 on her marathon debut . she defended her title 12 months later and will now seek a third title in the 17 April race .,sport,Tennis,Tennis,Paula Radcliffe will compete in the Flora London Marathon this year. The 31-year-old won the race in 2002 on her marathon debut.
aug_5_065.txt,Paula Radcliffe will compete in the Flora London Marathon this year . the 31-year-old won the race in 2002 on her marathon debut . she defended her title 12 months later and will now seek a third title in the 17 April race.,sport,Tennis,Tennis,The 31-year-old won the race in 2002 on her marathon debut. She defended her title 12 months later and will now seek a third title in the 17 April race.
